{
  "version": "v1",
  "split": "held_out",
  "dataset": "delhivery",
  "created_on": "2026-09-08",
  "notes": "Held-out Delhivery labels. Keep unused during extractor tuning; reserve for final evaluation.",
  "facts": [
    {
      "id": "del-hold-f01",
      "document_filename": "02-delhivery-annual-report-fy24-excerpt.pdf",
      "pdf_page_index": 21,
      "evidence_quote": "Revenue from Operations 74,540.82 66,586.61 81,415.38 72,253.01",
      "subject": "Delhivery revenue from operations",
      "predicate": "reports revenue from operations",
      "value_text": "66,586.61",
      "value_number": 66586.61,
      "unit": "million",
      "period": "FY23",
      "scope": "standalone",
      "estimate_status": "actual",
      "rationale": "Standalone FY23 revenue from the Directors' Report table."
    },
    {
      "id": "del-hold-f02",
      "document_filename": "02-delhivery-annual-report-fy24-excerpt.pdf",
      "pdf_page_index": 21,
      "evidence_quote": "Revenue from Operations 74,540.82 66,586.61 81,415.38 72,253.01",
      "subject": "Delhivery revenue from operations",
      "predicate": "reports revenue from operations",
      "value_text": "72,253.01",
      "value_number": 72253.01,
      "unit": "million",
      "period": "FY23",
      "scope": "consolidated",
      "estimate_status": "actual",
      "rationale": "Consolidated FY23 revenue from the same table."
    },
    {
      "id": "del-hold-f03",
      "document_filename": "02-delhivery-annual-report-fy24-excerpt.pdf",
      "pdf_page_index": 3,
      "evidence_quote": "₹81,415 ₹1,266",
      "subject": "Delhivery revenue from services",
      "predicate": "reports revenue from services",
      "value_text": "₹81,415",
      "value_number": 81415,
      "unit": "million",
      "period": "FY24",
      "scope": "consolidated",
      "estimate_status": "actual",
      "rationale": "Overview graphic pairs FY24 revenue 81,415 with EBITDA 1,266."
    },
    {
      "id": "del-hold-f04",
      "document_filename": "02-delhivery-annual-report-fy24-excerpt.pdf",
      "pdf_page_index": 7,
      "evidence_quote": "Over 32,000 shipments per hour",
      "subject": "Delhivery sorter throughput",
      "predicate": "reports shipments per hour",
      "value_text": "32,000",
      "value_number": 32000,
      "unit": "shipments per hour",
      "period": "FY24",
      "scope": null,
      "estimate_status": "actual",
      "rationale": "Operational highlight for sorter throughput."
    },
    {
      "id": "del-hold-f05",
      "document_filename": "02-delhivery-annual-report-fy24-excerpt.pdf",
      "pdf_page_index": 35,
      "evidence_quote": "y Revenues from TL services increased by 39.56% to",
      "subject": "Delhivery TL services revenue growth",
      "predicate": "reports year-over-year growth",
      "value_text": "39.56%",
      "value_number": 39.56,
      "unit": "percent",
      "period": "FY24",
      "scope": null,
      "estimate_status": "actual",
      "rationale": "Held-out reuse of TL growth claim for relationship checks."
    },
    {
      "id": "del-hold-f06",
      "document_filename": "03-delhivery-q4-fy24-earnings-presentation.pdf",
      "pdf_page_index": 4,
      "evidence_quote": "TL: 40% YoY revenue growth with service EBITDA profitability improvement",
      "subject": "Delhivery TL services revenue growth",
      "predicate": "reports year-over-year growth",
      "value_text": "40%",
      "value_number": 40,
      "unit": "percent",
      "period": "FY24",
      "scope": null,
      "estimate_status": "actual",
      "rationale": "Earnings highlights round TL growth to 40% YoY."
    },
    {
      "id": "del-hold-f07",
      "document_filename": "03-delhivery-q4-fy24-earnings-presentation.pdf",
      "pdf_page_index": 5,
      "evidence_quote": "YoY: 11.5% YoY: 29.8%",
      "subject": "Delhivery express parcel shipment growth",
      "predicate": "reports year-over-year growth",
      "value_text": "11.5%",
      "value_number": 11.5,
      "unit": "percent",
      "period": "FY24",
      "scope": null,
      "estimate_status": "actual",
      "rationale": "Express parcel shipment YoY growth on the FY24 snapshot slide."
    },
    {
      "id": "del-hold-f08",
      "document_filename": "03-delhivery-q4-fy24-earnings-presentation.pdf",
      "pdf_page_index": 5,
      "evidence_quote": "YoY: 11.5% YoY: 29.8%",
      "subject": "Delhivery PTL freight tonnage growth",
      "predicate": "reports year-over-year growth",
      "value_text": "29.8%",
      "value_number": 29.8,
      "unit": "percent",
      "period": "FY24",
      "scope": null,
      "estimate_status": "actual",
      "rationale": "PTL freight tonnage YoY growth on the same slide."
    },
    {
      "id": "del-hold-f09",
      "document_filename": "03-delhivery-q4-fy24-earnings-presentation.pdf",
      "pdf_page_index": 5,
      "evidence_quote": "740 Mn 1.4 Mn Tons",
      "subject": "Delhivery PTL freight tonnage",
      "predicate": "reports freight tonnage",
      "value_text": "1.4 Mn Tons",
      "value_number": 1.4,
      "unit": "million tonnes",
      "period": "FY24",
      "scope": null,
      "estimate_status": "actual",
      "rationale": "PTL freight tonnage for FY24."
    },
    {
      "id": "del-hold-f10",
      "document_filename": "03-delhivery-q4-fy24-earnings-presentation.pdf",
      "pdf_page_index": 4,
      "evidence_quote": "Sharp YoY reduction in NWC days from 38 to 31 days",
      "subject": "Delhivery net working capital days",
      "predicate": "reports NWC days",
      "value_text": "31 days",
      "value_number": 31,
      "unit": "days",
      "period": "FY24",
      "scope": null,
      "estimate_status": "actual",
      "rationale": "NWC days reduced to 31 in FY24."
    },
    {
      "id": "del-hold-f11",
      "document_filename": "03-delhivery-q4-fy24-earnings-presentation.pdf",
      "pdf_page_index": 4,
      "evidence_quote": "Sharp YoY reduction in NWC days from 38 to 31 days",
      "subject": "Delhivery net working capital days",
      "predicate": "reports NWC days",
      "value_text": "38 days",
      "value_number": 38,
      "unit": "days",
      "period": "FY23",
      "scope": null,
      "estimate_status": "actual",
      "rationale": "Prior-year NWC days of 38."
    },
    {
      "id": "del-hold-f12",
      "document_filename": "03-delhivery-q4-fy24-earnings-presentation.pdf",
      "pdf_page_index": 4,
      "evidence_quote": "FY24 EBITDA increased by Rs. 578 Cr to Rs. 127 Cr from Rs. (452 Cr) in FY23",
      "subject": "Delhivery EBITDA",
      "predicate": "reports EBITDA",
      "value_text": "Rs. (452 Cr)",
      "value_number": -4520,
      "unit": "million",
      "period": "FY23",
      "scope": "consolidated",
      "estimate_status": "actual",
      "rationale": "Prior-year EBITDA loss of Rs. 452 Cr."
    },
    {
      "id": "del-hold-f13",
      "document_filename": "02-delhivery-annual-report-fy24-excerpt.pdf",
      "pdf_page_index": 35,
      "evidence_quote": "EBITDA 1,266.41 (4,516.08)",
      "subject": "Delhivery EBITDA",
      "predicate": "reports EBITDA",
      "value_text": "(4,516.08)",
      "value_number": -4516.08,
      "unit": "million",
      "period": "FY23",
      "scope": "consolidated",
      "estimate_status": "actual",
      "rationale": "MDA FY23 EBITDA loss of 4,516.08 million."
    },
    {
      "id": "del-hold-f14",
      "document_filename": "02-delhivery-annual-report-fy24-excerpt.pdf",
      "pdf_page_index": 50,
      "evidence_quote": "over 33,250 active customers",
      "subject": "Delhivery active customers",
      "predicate": "reports active customers",
      "value_text": "33,250",
      "value_number": 33250,
      "unit": "customers",
      "period": "FY24",
      "scope": null,
      "estimate_status": "actual",
      "rationale": "Held-out active-customer claim for comparison with prospectus."
    },
    {
      "id": "del-hold-f15",
      "document_filename": "01-delhivery-prospectus-2022-excerpt.pdf",
      "pdf_page_index": 43,
      "evidence_quote": "No. of Active Customers 4,867 7,957 16,741 23,113",
      "subject": "Delhivery active customers",
      "predicate": "reports active customers",
      "value_text": "16,741",
      "value_number": 16741,
      "unit": "customers",
      "period": "FY21",
      "scope": null,
      "estimate_status": "actual",
      "rationale": "Prospectus KPI table active customers for FY21."
    },
    {
      "id": "del-hold-f16",
      "document_filename": "01-delhivery-prospectus-2022-excerpt.pdf",
      "pdf_page_index": 43,
      "evidence_quote": "No. of Active Customers 4,867 7,957 16,741 23,113",
      "subject": "Delhivery active customers",
      "predicate": "reports active customers",
      "value_text": "23,113",
      "value_number": 23113,
      "unit": "customers",
      "period": "nine months ended December 31, 2021",
      "scope": null,
      "estimate_status": "actual",
      "rationale": "Prospectus KPI table active customers for 9M FY22."
    },
    {
      "id": "del-hold-f17",
      "document_filename": "01-delhivery-prospectus-2022-excerpt.pdf",
      "pdf_page_index": 43,
      "evidence_quote": "16,538.97 27,805.75 36,465.27 48,105.30",
      "subject": "Delhivery revenue from contracts with customers",
      "predicate": "reports revenue from contracts with customers",
      "value_text": "36,465.27",
      "value_number": 36465.27,
      "unit": "million",
      "period": "FY21",
      "scope": null,
      "estimate_status": "actual",
      "rationale": "Prospectus KPI revenue for FY21."
    },
    {
      "id": "del-hold-f18",
      "document_filename": "01-delhivery-prospectus-2022-excerpt.pdf",
      "pdf_page_index": 43,
      "evidence_quote": "16,538.97 27,805.75 36,465.27 48,105.30",
      "subject": "Delhivery revenue from contracts with customers",
      "predicate": "reports revenue from contracts with customers",
      "value_text": "48,105.30",